{
  "assets": {
    "2:3": "https://s3-alpha.figma.com/assets/card.svg",
    "3:4": "https://s3-alpha.figma.com/assets/click.png"
  },
  "component_sets": {
    "1:101": {
      "description": "All button variants",
      "documentation_links": [],
      "key": "1:101",
      "kind": "component_set",
      "name": "Button Set"
    }
  },
  "components": {
    "1:100": {
      "description": "Primary action button",
      "documentation_links": [
        {
          "kind": "url",
          "url": "https://example.com/docs/primary-button"
        }
      ],
      "key": "1:100",
      "kind": "component",
      "name": "Primary Button"
    }
  },
  "file_key": "abc123",
  "name": "FigmaForge Demo \u2014 Button System",
  "pages": [
    {
      "children": [
        {
          "children": [],
          "dimensions": {
            "height": 40.0,
            "width": 120.0
          },
          "id": "1:2",
          "instance": {
            "component_id": "1:100",
            "main_component_id": "1:100"
          },
          "kind": "instance",
          "layout": {
            "mode": "none"
          },
          "name": "Primary Button",
          "node_type": "INSTANCE",
          "opacity": 0.9,
          "position": {
            "left": 0.0,
            "mode": "absolute",
            "top": 0.0,
            "x": 0.0,
            "y": 0.0
          },
          "raw": {
            "absoluteBoundingBox": {
              "height": 40,
              "width": 120,
              "x": 0,
              "y": 0
            },
            "componentId": "1:100",
            "constraints": {
              "horizontal": "SCALE",
              "vertical": "CENTER"
            },
            "id": "1:2",
            "mainComponent": {
              "id": "1:100",
              "name": "Primary Button",
              "type": "COMPONENT"
            },
            "name": "Primary Button",
            "opacity": 0.9,
            "type": "INSTANCE",
            "visible": true
          },
          "responsive": {
            "constraints_horizontal": "SCALE",
            "constraints_vertical": "CENTER"
          },
          "source": {
            "file_key": "abc123",
            "node_id": "1:2",
            "node_type": "INSTANCE",
            "path": [
              "0:0",
              "0:1"
            ]
          },
          "style": {
            "blurs": [],
            "borders": [],
            "fills": [],
            "opacity": 0.9,
            "shadows": []
          },
          "unknown": {},
          "visible": true
        },
        {
          "asset": {
            "node_id": "2:3",
            "url": "https://s3-alpha.figma.com/assets/card.svg"
          },
          "children": [
            {
              "asset": {
                "node_id": "3:4",
                "url": "https://s3-alpha.figma.com/assets/click.png"
              },
              "children": [],
              "dimensions": {},
              "id": "3:4",
              "kind": "text",
              "layout": {
                "mode": "none"
              },
              "name": "Click me",
              "node_type": "TEXT",
              "opacity": 1.0,
              "position": {
                "mode": "auto"
              },
              "prototype": {
                "interactions": [],
                "links": [
                  {
                    "kind": "url",
                    "url": "https://example.com/click"
                  }
                ]
              },
              "raw": {
                "boundVariables": {
                  "fontSize": {
                    "id": "1:40",
                    "type": "VARIABLE_ALIAS"
                  }
                },
                "characters": "Click me",
                "fills": [
                  {
                    "color": {
                      "a": 1.0,
                      "b": 0.1,
                      "g": 0.4,
                      "r": 0.9
                    },
                    "opacity": 1.0,
                    "type": "SOLID",
                    "visible": true
                  }
                ],
                "id": "3:4",
                "name": "Click me",
                "style": {
                  "fontFamily": "Inter",
                  "fontPostScriptName": "Inter-Regular",
                  "fontSize": 16,
                  "fontWeight": 400,
                  "hyperlink": {
                    "type": "URL",
                    "url": "https://example.com/click"
                  },
                  "letterSpacing": 0,
                  "lineHeightPx": 24,
                  "textCase": "ORIGINAL",
                  "textDecoration": "NONE"
                },
                "type": "TEXT",
                "visible": true
              },
              "responsive": {},
              "source": {
                "file_key": "abc123",
                "node_id": "3:4",
                "node_type": "TEXT",
                "path": [
                  "0:0",
                  "0:1",
                  "2:3"
                ]
              },
              "style": {
                "blurs": [],
                "borders": [],
                "fills": [
                  {
                    "color": {
                      "a": 1.0,
                      "b": 0.1,
                      "g": 0.4,
                      "r": 0.9
                    },
                    "gradient_stops": [],
                    "kind": "solid",
                    "opacity": 1.0,
                    "visible": true
                  }
                ],
                "opacity": 1.0,
                "shadows": []
              },
              "text": {
                "characters": "Click me",
                "hyperlink": {
                  "kind": "url",
                  "url": "https://example.com/click"
                }
              },
              "tokens": {
                "bound_variables": {
                  "fontSize": "1:40"
                },
                "refs": [
                  {
                    "kind": "variable",
                    "property_name": "fontSize",
                    "token_key": "1:40"
                  }
                ],
                "style_refs": {}
              },
              "typography": {
                "font_family": "Inter",
                "font_postscript_name": "Inter-Regular",
                "font_size": 16.0,
                "font_weight": 400.0,
                "letter_spacing": 0.0,
                "line_height": 24.0,
                "text_case": "ORIGINAL",
                "text_decoration": "NONE",
                "token_refs": [
                  "1:40"
                ]
              },
              "unknown": {},
              "visible": true
            },
            {
              "children": [
                {
                  "children": [],
                  "dimensions": {},
                  "id": "5:6",
                  "kind": "vector",
                  "layout": {
                    "mode": "none"
                  },
                  "name": "Arrow",
                  "node_type": "VECTOR",
                  "opacity": 1.0,
                  "position": {
                    "mode": "absolute"
                  },
                  "raw": {
                    "fills": [
                      {
                        "color": {
                          "a": 1.0,
                          "b": 1.0,
                          "g": 1.0,
                          "r": 1.0
                        },
                        "opacity": 1.0,
                        "type": "SOLID",
                        "visible": true
                      }
                    ],
                    "id": "5:6",
                    "name": "Arrow",
                    "opacity": 1.0,
                    "type": "VECTOR",
                    "visible": true
                  },
                  "responsive": {},
                  "source": {
                    "file_key": "abc123",
                    "node_id": "5:6",
                    "node_type": "VECTOR",
                    "path": [
                      "0:0",
                      "0:1",
                      "2:3",
                      "4:5"
                    ]
                  },
                  "style": {
                    "blurs": [],
                    "borders": [],
                    "fills": [
                      {
                        "color": {
                          "a": 1.0,
                          "b": 1.0,
                          "g": 1.0,
                          "r": 1.0
                        },
                        "gradient_stops": [],
                        "kind": "solid",
                        "opacity": 1.0,
                        "visible": true
                      }
                    ],
                    "opacity": 1.0,
                    "shadows": []
                  },
                  "unknown": {},
                  "visible": true
                }
              ],
              "dimensions": {},
              "id": "4:5",
              "kind": "group",
              "layout": {
                "mode": "none"
              },
              "name": "Icon Slot",
              "node_type": "GROUP",
              "opacity": 1.0,
              "position": {
                "mode": "auto"
              },
              "raw": {
                "children": [
                  {
                    "fills": [
                      {
                        "color": {
                          "a": 1.0,
                          "b": 1.0,
                          "g": 1.0,
                          "r": 1.0
                        },
                        "opacity": 1.0,
                        "type": "SOLID",
                        "visible": true
                      }
                    ],
                    "id": "5:6",